{
  "record_spdx_license": "GPL-3.0-or-later",
  "format": "tos-capsule-vector-provenance-v1",
  "schema_version": 1,
  "vectors": [
    {
      "vector": "valid-001.bin",
      "sha256": "e60dd9b6a0db47d68346364c8dc9be0ee384df715e36d1823c2f005c4911670c",
      "generated_artifact": true,
      "provenance_status": "verified",
      "generator": {
        "path": "source/tests/vectors/gen/gen.sh",
        "version": 1,
        "source_commit": "899a88381c6d53d39549645290436b859a2fc7ea",
        "sha256": "c74c2a7a67b2b5c644bf0e376d1243f5d35a448f2a19bd3982fde0c9b12c42c1",
        "spdx": "GPL-3.0-or-later"
      },
      "source_commit": {
        "kind": "git",
        "algorithm": "sha1",
        "value": "899a88381c6d53d39549645290436b859a2fc7ea"
      },
      "inputs": [
        {
          "repository_path": "source/system/boot/init.tos",
          "capsule_path": "/system/boot/init.tos",
          "sha256": "2d017c8fc7096f43afee21b0497169207cda63633b822a654a6a4e055a576918",
          "spdx": [
            "GPL-3.0-or-later"
          ],
          "role": "embedded canonical boot source"
        },
        {
          "repository_path": "VERSION",
          "capsule_path": "/system/version",
          "sha256": "71015c979ccb0fc8a0be7ca0ae83046ab045cdc2c8faa09fb2f0f7e440f9b4a6",
          "spdx": [
            "GPL-3.0-or-later"
          ],
          "role": "embedded canonical version source"
        },
        {
          "repository_path": "source/system/boot/NOTICES.txt",
          "capsule_path": null,
          "sha256": "c5dac29a4e7232d12a4ad45923e443150f7d3fa0d586d82002501234f5b87d5c",
          "spdx": [
            "GPL-3.0-or-later"
          ],
          "role": "embedded licence notice tail"
        }
      ],
      "container_licensing": {
        "status": "mixed-material-generated",
        "spdx_expression": null
      },
      "derivation": null
    },
    {
      "vector": "invalid-missing-boot.bin",
      "sha256": "2f6c0059654e1f2e5e2a47317a7c67830c8848431596ac00779594fc59ffd1ff",
      "generated_artifact": true,
      "provenance_status": "verified",
      "generator": {
        "path": "source/tests/vectors/gen/gen.sh",
        "version": 1,
        "source_commit": "899a88381c6d53d39549645290436b859a2fc7ea",
        "sha256": "c74c2a7a67b2b5c644bf0e376d1243f5d35a448f2a19bd3982fde0c9b12c42c1",
        "spdx": "GPL-3.0-or-later"
      },
      "source_commit": {
        "kind": "git",
        "algorithm": "sha1",
        "value": "899a88381c6d53d39549645290436b859a2fc7ea"
      },
      "inputs": [
        {
          "repository_path": "VERSION",
          "capsule_path": "/system/version",
          "sha256": "71015c979ccb0fc8a0be7ca0ae83046ab045cdc2c8faa09fb2f0f7e440f9b4a6",
          "spdx": [
            "GPL-3.0-or-later"
          ],
          "role": "embedded canonical version source"
        }
      ],
      "container_licensing": {
        "status": "mixed-material-generated",
        "spdx_expression": null
      },
      "derivation": null
    },
    {
      "vector": "invalid-traversal.bin",
      "sha256": "23a21c9e92ff4891d74488cb6ade0815315cf02459825b005ecbba03a24f2500",
      "generated_artifact": true,
      "provenance_status": "verified",
      "generator": {
        "path": "source/tests/vectors/gen/gen.sh",
        "version": 1,
        "source_commit": "899a88381c6d53d39549645290436b859a2fc7ea",
        "sha256": "c74c2a7a67b2b5c644bf0e376d1243f5d35a448f2a19bd3982fde0c9b12c42c1",
        "spdx": "GPL-3.0-or-later"
      },
      "source_commit": {
        "kind": "git",
        "algorithm": "sha1",
        "value": "899a88381c6d53d39549645290436b859a2fc7ea"
      },
      "inputs": [
        {
          "repository_path": "source/system/boot/init.tos",
          "capsule_path": "/system/boot/init.tos",
          "sha256": "2d017c8fc7096f43afee21b0497169207cda63633b822a654a6a4e055a576918",
          "spdx": [
            "GPL-3.0-or-later"
          ],
          "role": "embedded canonical boot source"
        },
        {
          "repository_path": "VERSION",
          "capsule_path": "/system/../etc/passwd",
          "sha256": "71015c979ccb0fc8a0be7ca0ae83046ab045cdc2c8faa09fb2f0f7e440f9b4a6",
          "spdx": [
            "GPL-3.0-or-later"
          ],
          "role": "embedded canonical version source under invalid path"
        }
      ],
      "container_licensing": {
        "status": "mixed-material-generated",
        "spdx_expression": null
      },
      "derivation": null
    },
    {
      "vector": "invalid-dup.bin",
      "sha256": "3df957a46f826e0e2444c18ca83ea09aecd322b25ffa144fa4cab410127da8bb",
      "generated_artifact": true,
      "provenance_status": "verified",
      "generator": {
        "path": "source/tests/vectors/gen/gen.sh",
        "version": 1,
        "source_commit": "899a88381c6d53d39549645290436b859a2fc7ea",
        "sha256": "c74c2a7a67b2b5c644bf0e376d1243f5d35a448f2a19bd3982fde0c9b12c42c1",
        "spdx": "GPL-3.0-or-later"
      },
      "source_commit": {
        "kind": "git",
        "algorithm": "sha1",
        "value": "899a88381c6d53d39549645290436b859a2fc7ea"
      },
      "inputs": [
        {
          "repository_path": "source/system/boot/init.tos",
          "capsule_path": "/system/boot/init.tos",
          "sha256": "2d017c8fc7096f43afee21b0497169207cda63633b822a654a6a4e055a576918",
          "spdx": [
            "GPL-3.0-or-later"
          ],
          "role": "first embedded canonical boot source"
        },
        {
          "repository_path": "source/system/boot/init.tos",
          "capsule_path": "/system/boot/init.tos",
          "sha256": "2d017c8fc7096f43afee21b0497169207cda63633b822a654a6a4e055a576918",
          "spdx": [
            "GPL-3.0-or-later"
          ],
          "role": "duplicate embedded canonical boot source"
        }
      ],
      "container_licensing": {
        "status": "mixed-material-generated",
        "spdx_expression": null
      },
      "derivation": null
    },
    {
      "vector": "invalid-badmagic.bin",
      "sha256": "5336f81e1b6af65a6d6585c18917b543fb399e0de550992a149568b3ffe7b714",
      "generated_artifact": true,
      "provenance_status": "verified",
      "generator": {
        "path": "source/tests/vectors/gen/gen.sh",
        "version": 1,
        "source_commit": "899a88381c6d53d39549645290436b859a2fc7ea",
        "sha256": "c74c2a7a67b2b5c644bf0e376d1243f5d35a448f2a19bd3982fde0c9b12c42c1",
        "spdx": "GPL-3.0-or-later"
      },
      "source_commit": {
        "kind": "git",
        "algorithm": "sha1",
        "value": "899a88381c6d53d39549645290436b859a2fc7ea"
      },
      "inputs": [
        {
          "repository_path": "source/system/boot/init.tos",
          "capsule_path": "/system/boot/init.tos",
          "sha256": "2d017c8fc7096f43afee21b0497169207cda63633b822a654a6a4e055a576918",
          "spdx": [
            "GPL-3.0-or-later"
          ],
          "role": "embedded canonical boot source"
        },
        {
          "repository_path": "VERSION",
          "capsule_path": "/system/version",
          "sha256": "71015c979ccb0fc8a0be7ca0ae83046ab045cdc2c8faa09fb2f0f7e440f9b4a6",
          "spdx": [
            "GPL-3.0-or-later"
          ],
          "role": "embedded canonical version source"
        },
        {
          "repository_path": "source/system/boot/NOTICES.txt",
          "capsule_path": null,
          "sha256": "c5dac29a4e7232d12a4ad45923e443150f7d3fa0d586d82002501234f5b87d5c",
          "spdx": [
            "GPL-3.0-or-later"
          ],
          "role": "embedded licence notice tail"
        }
      ],
      "container_licensing": {
        "status": "mixed-material-generated",
        "spdx_expression": null
      },
      "derivation": {
        "base_vector": "valid-001.bin",
        "base_sha256": "e60dd9b6a0db47d68346364c8dc9be0ee384df715e36d1823c2f005c4911670c",
        "transformation_recipe": {
          "kind": "header-byte-rewrite",
          "operations": [
            {
              "op": "write-byte",
              "offset": 0,
              "value_hex": "ff"
            }
          ]
        }
      }
    },
    {
      "vector": "invalid-truncated.bin",
      "sha256": "f3e1f3f134344477f1bf04ac101d02662a1610b0f4cb7b23627f86906d2d96b2",
      "generated_artifact": true,
      "provenance_status": "verified",
      "generator": {
        "path": "source/tests/vectors/gen/gen.sh",
        "version": 1,
        "source_commit": "899a88381c6d53d39549645290436b859a2fc7ea",
        "sha256": "c74c2a7a67b2b5c644bf0e376d1243f5d35a448f2a19bd3982fde0c9b12c42c1",
        "spdx": "GPL-3.0-or-later"
      },
      "source_commit": {
        "kind": "git",
        "algorithm": "sha1",
        "value": "899a88381c6d53d39549645290436b859a2fc7ea"
      },
      "inputs": [
        {
          "repository_path": "source/system/boot/init.tos",
          "capsule_path": "/system/boot/init.tos",
          "sha256": "2d017c8fc7096f43afee21b0497169207cda63633b822a654a6a4e055a576918",
          "spdx": [
            "GPL-3.0-or-later"
          ],
          "role": "embedded canonical boot source"
        },
        {
          "repository_path": "VERSION",
          "capsule_path": "/system/version",
          "sha256": "71015c979ccb0fc8a0be7ca0ae83046ab045cdc2c8faa09fb2f0f7e440f9b4a6",
          "spdx": [
            "GPL-3.0-or-later"
          ],
          "role": "embedded canonical version source"
        },
        {
          "repository_path": "source/system/boot/NOTICES.txt",
          "capsule_path": null,
          "sha256": "c5dac29a4e7232d12a4ad45923e443150f7d3fa0d586d82002501234f5b87d5c",
          "spdx": [
            "GPL-3.0-or-later"
          ],
          "role": "embedded licence notice tail"
        }
      ],
      "container_licensing": {
        "status": "mixed-material-generated",
        "spdx_expression": null
      },
      "derivation": {